{
  "protocol": "repo-claims/v1",
  "owner": "codex-decomplexity",
  "client": "codex",
  "task": "decomplexity passes across tarpit core and demo",
  "mode": "edit",
  "scope": [
    "src/tarpit/**",
    "src/todo-schema.ts",
    "src/App.tsx",
    "package.json",
    "tsconfig.json"
  ],
  "created_at": "2026-06-24T02:24:49Z",
  "updated_at": "2026-06-24T02:27:03Z",
  "expires_at": "2026-06-24T02:37:03Z"
}
