{
  "protocol": "repo-claims/v1",
  "owner": "codex-automerge-source",
  "client": "codex",
  "task": "add generic relation source backed by in-memory automerge repo demo",
  "mode": "edit",
  "scope": [
    "src/tarpit/evaluate.ts",
    "src/tarpit/index.ts",
    "src/tarpit/source.ts",
    "src/main.tsx",
    "src/todo-schema.ts",
    "src/App.tsx",
    "vite.config.ts",
    "package.json",
    "pnpm-lock.yaml"
  ],
  "created_at": "2026-06-24T02:34:27Z",
  "updated_at": "2026-06-24T02:42:40Z",
  "expires_at": "2026-06-24T02:52:40Z"
}
